id,name,founded,dissolved,leader,members,affiliation,description,films
,Imperial Security Bureau,19 BBY,5 ABY,Major Partagaz,"Dedra Meero, Supervisor Blevin",Galactic Empire,Imperial intelligence and internal security agency.,"Andor, Star Wars Rebels"
,Children of the Watch,,,The Armorer,"Din Djarin, Paz Vizsla",Mandalorians,Traditionalist Mandalorian covert following the Way of the Mandalore.,"The Mandalorian"
,New Republic,4 ABY,34 ABY,Mon Mothma,"Carson Teva, Hera Syndulla",None,Democratic government formed after the Galactic Civil War.,"The Mandalorian, Ahsoka"
,Imperial Remnant,4 ABY,,Moff Gideon,"Dr. Pershing, Dark Troopers",Galactic Empire,Surviving Imperial factions after the Battle of Endor.,"The Mandalorian"
,The Hidden Path,19 BBY,,Tala Durith,"Obi-Wan Kenobi, Roken",None,Underground network helping Jedi and Force-sensitive people escape the Empire.,"Obi-Wan Kenobi"
,Aldhani Rebel Cell,5 BBY,5 BBY,Vel Sartha,"Cinta Kaz, Nemik, Taramyn Barcona",Rebel Alliance,Small rebel team that attacked the Imperial garrison on Aldhani.,"Andor"
,Nite Owls,,,Bo-Katan Kryze,"Koska Reeves, Axe Woves",Mandalorians,Mandalorian faction associated with Bo-Katan Kryze.,"The Mandalorian, Star Wars: The Clone Wars"
